{
  "$schema": "../schema/encoding-conversion.schema.json",
  "schema_version": 1,
  "profile": "cldr-zawgyi-v1",
  "rule_source": {
    "name": "google-myanmar-tools",
    "version": "1.2.0",
    "license": "Apache-2.0",
    "source": "https://github.com/google/myanmar-tools/tree/v1.2.0/clients/js"
  },
  "description": "Explicit whole-string conversion between standard Myanmar Unicode and Zawgyi-One.",
  "license": "MIT; Rabbit-derived cases retain WTFPL",
  "sources": [
    "https://github.com/google/myanmar-tools/tree/v1.2.0/clients/js",
    "https://github.com/Rabbit-Converter/Rabbit/blob/081d464a91ab4dde14b799a54d1e89dde55b438e/source/res/sample.json"
  ],
  "derivation": "Google Myanmar Tools generated rules were adapted without changing rule order. Its 126 data-driven fixtures are retained as Zawgyi-to-Unicode cases. Rabbit sample pairs are retained as secondary compatibility cases.",
  "review_status": "source_verified",
  "cases": [
    {
      "id": "empty-zawgyi-to-unicode",
      "input": "",
      "from": "zawgyi",
      "to": "unicode",
      "expected": "",
      "changed": false,
      "source": "project-authored",
      "basis": "Empty input is preserved."
    },
    {
      "id": "unicode-identity",
      "input": "မြန်မာ",
      "from": "unicode",
      "to": "unicode",
      "expected": "မြန်မာ",
      "changed": false,
      "source": "project-authored",
      "basis": "Equal source and target encodings are an exact no-op."
    },
    {
      "id": "zawgyi-identity",
      "input": "ျမန္မာ",
      "from": "zawgyi",
      "to": "zawgyi",
      "expected": "ျမန္မာ",
      "changed": false,
      "source": "project-authored",
      "basis": "Equal source and target encodings are an exact no-op."
    },
    {
      "id": "non-myanmar-preserved",
      "input": "MyanLex 👋 123",
      "from": "zawgyi",
      "to": "unicode",
      "expected": "MyanLex 👋 123",
      "changed": false,
      "source": "project-authored",
      "basis": "Characters not matched by conversion rules are preserved."
    },
    {
      "id": "google-basic-zawgyi-to-unicode",
      "input": "မ္း",
      "from": "zawgyi",
      "to": "unicode",
      "expected": "မ်း",
      "changed": true,
      "source": "google-myanmar-tools",
      "basis": "Documented Google Myanmar Tools JavaScript example."
    },
    {
      "id": "google-basic-unicode-to-zawgyi",
      "input": "မ်း",
      "from": "unicode",
      "to": "zawgyi",
      "expected": "မ္း",
      "changed": true,
      "source": "google-myanmar-tools",
      "basis": "Reverse direction of the documented basic compatibility example."
    },
    {
      "id": "udhr-zawgyi-to-unicode",
      "input": "အျပည္ျပည္ဆိုင္ရာ လူ႔အခြင့္အေရး ေၾကညာစာတမ္း",
      "from": "zawgyi",
      "to": "unicode",
      "expected": "အပြည်ပြည်ဆိုင်ရာ လူ့အခွင့်အရေး ကြေညာစာတမ်း",
      "changed": true,
      "source": "google-myanmar-tools",
      "basis": "Representative UDHR wording from the upstream compatibility data."
    },
    {
      "id": "udhr-unicode-to-zawgyi",
      "input": "အပြည်ပြည်ဆိုင်ရာ လူ့အခွင့်အရေး ကြေညာစာတမ်း",
      "from": "unicode",
      "to": "zawgyi",
      "expected": "အျပည္ျပည္ဆိုင္ရာ လူ႔အခြင့္အေရး ေၾကညာစာတမ္း",
      "changed": true,
      "source": "google-myanmar-tools",
      "basis": "CLDR-derived Unicode-to-Zawgyi output for representative UDHR wording."
    },
    {
      "id": "google-zawgyi-to-unicode-001",
      "input": " ",
      "from": "zawgyi",
      "to": "unicode",
      "expected": " ",
      "changed": false,
      "source": "google-myanmar-tools",
      "basis": "Google Myanmar Tools data-driven converter fixture 1."
    },
    {
      "id": "google-zawgyi-to-unicode-002",
      "input": "123",
      "from": "zawgyi",
      "to": "unicode",
      "expected": "123",
      "changed": false,
      "source": "google-myanmar-tools",
      "basis": "Google Myanmar Tools data-driven converter fixture 2."
    },
    {
      "id": "google-zawgyi-to-unicode-003",
      "input": "abc",
      "from": "zawgyi",
      "to": "unicode",
      "expected": "abc",
      "changed": false,
      "source": "google-myanmar-tools",
      "basis": "Google Myanmar Tools data-driven converter fixture 3."
    },
    {
      "id": "google-zawgyi-to-unicode-004",
      "input": ".!@|",
      "from": "zawgyi",
      "to": "unicode",
      "expected": ".!@|",
      "changed": false,
      "source": "google-myanmar-tools",
      "basis": "Google Myanmar Tools data-driven converter fixture 4."
    },
    {
      "id": "google-zawgyi-to-unicode-005",
      "input": "အာဏာပိုင္ေတြ",
      "from": "zawgyi",
      "to": "unicode",
      "expected": "အာဏာပိုင်တွေ",
      "changed": true,
      "source": "google-myanmar-tools",
      "basis": "Google Myanmar Tools data-driven converter fixture 5."
    },
    {
      "id": "google-zawgyi-to-unicode-006",
      "input": "ဘယ္ေလာက္တားတား ",
      "from": "zawgyi",
      "to": "unicode",
      "expected": "ဘယ်လောက်တားတား ",
      "changed": true,
      "source": "google-myanmar-tools",
      "basis": "Google Myanmar Tools data-driven converter fixture 6."
    },
    {
      "id": "google-zawgyi-to-unicode-007",
      "input": "ထိုင္းကို",
      "from": "zawgyi",
      "to": "unicode",
      "expected": "ထိုင်းကို",
      "changed": true,
      "source": "google-myanmar-tools",
      "basis": "Google Myanmar Tools data-driven converter fixture 7."
    },
    {
      "id": "google-zawgyi-to-unicode-008",
      "input": "ႏိုင္ၿပီး",
      "from": "zawgyi",
      "to": "unicode",
      "expected": "နိုင်ပြီး",
      "changed": true,
      "source": "google-myanmar-tools",
      "basis": "Google Myanmar Tools data-driven converter fixture 8."
    },
    {
      "id": "google-zawgyi-to-unicode-009",
      "input": "ေျခတလွမ္းတိုးလိုက္တဲ့",
      "from": "zawgyi",
      "to": "unicode",
      "expected": "ခြေတလှမ်းတိုးလိုက်တဲ့",
      "changed": true,
      "source": "google-myanmar-tools",
      "basis": "Google Myanmar Tools data-driven converter fixture 9."
    },
    {
      "id": "google-zawgyi-to-unicode-010",
      "input": "ျမန္မာ ",
      "from": "zawgyi",
      "to": "unicode",
      "expected": "မြန်မာ ",
      "changed": true,
      "source": "google-myanmar-tools",
      "basis": "Google Myanmar Tools data-driven converter fixture 10."
    },
    {
      "id": "google-zawgyi-to-unicode-011",
      "input": "အမ်ိဳးသမီး",
      "from": "zawgyi",
      "to": "unicode",
      "expected": "အမျိုးသမီး",
      "changed": true,
      "source": "google-myanmar-tools",
      "basis": "Google Myanmar Tools data-driven converter fixture 11."
    },
    {
      "id": "google-zawgyi-to-unicode-012",
      "input": "ေဘာလံုးအသင္း",
      "from": "zawgyi",
      "to": "unicode",
      "expected": "ဘောလုံးအသင်း",
      "changed": true,
      "source": "google-myanmar-tools",
      "basis": "Google Myanmar Tools data-driven converter fixture 12."
    },
    {
      "id": "google-zawgyi-to-unicode-013",
      "input": "ေဆာင္းဦးလင္း",
      "from": "zawgyi",
      "to": "unicode",
      "expected": "ဆောင်းဦးလင်း",
      "changed": true,
      "source": "google-myanmar-tools",
      "basis": "Google Myanmar Tools data-driven converter fixture 13."
    },
    {
      "id": "google-zawgyi-to-unicode-014",
      "input": "ျမန္မာအသင္းဟာ",
      "from": "zawgyi",
      "to": "unicode",
      "expected": "မြန်မာအသင်းဟာ",
      "changed": true,
      "source": "google-myanmar-tools",
      "basis": "Google Myanmar Tools data-driven converter fixture 14."
    },
    {
      "id": "google-zawgyi-to-unicode-015",
      "input": "အာဆီယံေဒသတြင္းမွ ",
      "from": "zawgyi",
      "to": "unicode",
      "expected": "အာဆီယံဒေသတွင်းမှ ",
      "changed": true,
      "source": "google-myanmar-tools",
      "basis": "Google Myanmar Tools data-driven converter fixture 15."
    },
    {
      "id": "google-zawgyi-to-unicode-016",
      "input": " တသင္းတည္းေသာ ",
      "from": "zawgyi",
      "to": "unicode",
      "expected": " တသင်းတည်းသော ",
      "changed": true,
      "source": "google-myanmar-tools",
      "basis": "Google Myanmar Tools data-driven converter fixture 16."
    },
    {
      "id": "google-zawgyi-to-unicode-017",
      "input": " အသင္းအျဖစ္ ",
      "from": "zawgyi",
      "to": "unicode",
      "expected": " အသင်းအဖြစ် ",
      "changed": true,
      "source": "google-myanmar-tools",
      "basis": "Google Myanmar Tools data-driven converter fixture 17."
    },
    {
      "id": "google-zawgyi-to-unicode-018",
      "input": "ျမန္မာ့ႏိုင္ငံေရးမွာ",
      "from": "zawgyi",
      "to": "unicode",
      "expected": "မြန်မာ့နိုင်ငံရေးမှာ",
      "changed": true,
      "source": "google-myanmar-tools",
      "basis": "Google Myanmar Tools data-driven converter fixture 18."
    },
    {
      "id": "google-zawgyi-to-unicode-019",
      "input": "စစ္တပ္ပါဝင္ၿပီး",
      "from": "zawgyi",
      "to": "unicode",
      "expected": "စစ်တပ်ပါဝင်ပြီး",
      "changed": true,
      "source": "google-myanmar-tools",
      "basis": "Google Myanmar Tools data-driven converter fixture 19."
    },
    {
      "id": "google-zawgyi-to-unicode-020",
      "input": "ဆိုရင္",
      "from": "zawgyi",
      "to": "unicode",
      "expected": "ဆိုရင်",
      "changed": true,
      "source": "google-myanmar-tools",
      "basis": "Google Myanmar Tools data-driven converter fixture 20."
    },
    {
      "id": "google-zawgyi-to-unicode-021",
      "input": "ျပဳျပင္ေျပာင္းလဲေရးေဖာ္ေဆာင္ေနတဲ့",
      "from": "zawgyi",
      "to": "unicode",
      "expected": "ပြုပြင်ပြောင်းလဲရေးဖော်ဆောင်နေတဲ့",
      "changed": true,
      "source": "google-myanmar-tools",
      "basis": "Google Myanmar Tools data-driven converter fixture 21."
    },
    {
      "id": "google-zawgyi-to-unicode-022",
      "input": "ပညာေရးေပၚလစီဆိုုင္ရာ",
      "from": "zawgyi",
      "to": "unicode",
      "expected": "ပညာရေးပေါ်လစီဆိုင်ရာ",
      "changed": true,
      "source": "google-myanmar-tools",